{"frames":3,"h":32,"id":"SURF_BLOB","png":"iVBORw0KGgoAAAANSUhEUgAAACAAAABgCAYAAAB8InCYAAAArElEQVR42u2WwQ3AIBDDmK5DdAjm7FYtCyAaKXB52BJv+wOhNQAAgJ9c/XmVUyK1xrjkcoRbLIXsli8jSgNOyacRBBDANYx4CSO2IGYNI/4DAAAAEMU9Nl45JVJrjEsuR7jFUshu+TKiNOCUfBpBAAFcw4iXMGILYtYw4j8AAAAAUfSx8copkVpjXHI5wi2WQnbLlxGlAafk0wgCCOAaRryEEVsQs4YR/wE4wQclX8GOaOEd1gAAAABJRU5ErkJggg==","w":32}