{"frames":9,"gid":7,"h":32,"id":"OBJ_EVENT_GFX_TEST_PERSON","png":"iVBORw0KGgoAAAANSUhEUgAAABAAAAEgCAYAAAC9/vN4AAAAmElEQVR42u3RIQ5CARBDwX8cNBqN/hqNRnMcbgrrSSqbFfOS2jE9Dv11OT/fNAAAAAAAuoA2dJ2r0gAAAAAA6ALa0G2uSgMAAAAAoAtoQ/e5Kg0AAAAAgC6gDZ1zVRoAAAAAAF1AG3rMVWkAAAAAAHQBbeg5V6UBAAAAANAFtKHXXJUGAAAAAEAX0Ibec1UaAAAAAABdoN4PCh1tobsvS5MAAAAASUVORK5CYII=","w":16}